{"id":"22222222-2222-2222-2222-222222222222","payload":{"data":{"results":[{"snippet":"Example snippet","title":"Example","url":"https://example.com"}]},"request_id":"11111111-1111-1111-1111-111111111111","status":"success"},"protocol":"agora/1.0","sender":{"id":"3-16JdwMd27WniKVDqmTOdlgau3DQAFkV3Oy3N4L1rY","signature":""},"timestamp":"2024-01-02T12:34:56Z","type":"RESULT"}
