{
  "protocol": "agora/1.0",
  "id": "22222222-2222-2222-2222-222222222222",
  "timestamp": "2024-01-02T12:34:56Z",
  "type": "RESULT",
  "sender": {
    "id": "3-16JdwMd27WniKVDqmTOdlgau3DQAFkV3Oy3N4L1rY",
    "signature": "rt-heKwD7oYkUHdjRwEt_wAe84be2MJoOtjqHFG5MCEKklLP2acGlU6bew7asGafjqveBcALm0tQZEcoPYPlDA"
  },
  "payload": {
    "request_id": "11111111-1111-1111-1111-111111111111",
    "status": "success",
    "data": {
      "results": [
        {
          "title": "Example",
          "url": "https://example.com",
          "snippet": "Example snippet"
        }
      ]
    }
  }
}
